sentence,condition
MAVE SHRULLED OD HUS SPOMES ROAT OSE PUCKED UD REE COS KEES,N
OT WAM O MOUGH LONK RIMP SCROUGH REE RUD OSE MOT HOWED,N
OT OS VODY MUME O MOLLER OY BOACHING REE FEELLOTIONS OY CORCORITY,N
HUS WROLL BLONS EAFS DOLDED INSAWS REE USIVE OBUL OY HUS FOPE,N
E TEEK REE PAPE OSE CHEVEL OSE WEWS OOT OD REE POLKS,N
HU WEWS RO REE SNONT WOOR OSE OBONED OT OSE LOAKED EN,N
LEENS CAG FOGE OP IMPORLENT CLIDGE BESHOON REE PRESIBOTE OSE REE FOPURCY,N
REE RILKS RO LEOMS FUCOCIES SHOURN NE PELPRONTIOLLY REGUGNS OSE OBTINOSSLY ELUSIPATED,N
E HUD HELT REE DRORD QUEY DERE ROXING WHIMP SOUSSING REE STOITS,N
REE POGOR OS FONKING OT OMEWOCK RO COMPOTHS OGIMMS HUS OPE REGOND,N
REE UNTERS LIPETISE HUD HIRMEN THULPELVES EN REE GROMP OSE REE BRUBS,N
BOME DEET ONK BELLER FOM SUME WOFT FRON EDY FOGE OY DRONNER,N
EN REE STONLISKS HU COURN MEE REE PREES STRICKED OY FREIR LEORED,N
E WEWS RO JISIL AMSHED EN REE KINGSTON FOBBITOL O WEW TIVES,N
PLIN PROCEFOSE OS MUME HORE EGGOCTIVE FRON GOVING OOT O ROMMERSHIP MICKET,N
QUEY ONK REE MOGS BOOLTISUL POME OY FROT TOTTLE PIEKS OY LOTURE,N
TOOD SOSIO DROLI HOR OTS OPE SPEVEOL DENENDS FROT COYLY NIED REIMPEDURANTER,N
WHIKE HOULE HOGILCOTIVE OYERS DERE STULL CONVIDOTE REE BIGS WOURN PODE INDECT,N
QUOTHER OM VOT WANTY LOMS HUS JOW WAM VO CONCUCT OY MONE,N
GRENCELCA OSE HERSORT DERE OBUNG REE WEW DOOPLE DE WREW EN DORECONIO,N
RO HABS SORNNAY FROT LOND LEFORNED WAM QUAT HU HUD LINCE FOM,N
SOTH DOOPLE CAG COSMS OLBUST OTUBLING OOT OY O PIEKS OY DOOD,N
ET ORKS O BUPY OY DEGS WAM SWIPPING OSE SNURVING OTOUSE HOM,N
HU GOL O WROLL FIMS PRORTED OSE DUT OD BABIN OSE COCTEE,N
REE LOUF DROCKS ONK EN WRO TOGERS OSE ONK VOT RURTORED LOGELLER,N
CY PLIN TICE LOLKS NURGERS OY REE ORIENCE HUD LELD REE HORS,N
LUT E UMLY PROUGHT OY FROT EN REE MIGGLE OY REE NIFFS,N
FREIR RURIES INSPODE ELUSEITION OY REE INRONGOTION COTTOCTED OSE PRODENOTION OY RETORCORDOTIONS,N
ADYTHE MUTTLED DOIL RO BEMIME O SOVEAL MYME OSE O FERMIBLE EXAYBRA,N
E COURN VOT CLIVE RO HY POMS NOM DOD E WIBS RO,N
NOVE OY UR WAM OFURE FROT REE BIBBEST FIFFS WAM STULL OFO,N
E FILLAWED FREM EN REE JOUP OSE NOY QUEY DOD VOT CANK,N
E CRODGED REE BOOLTISELLY FURNOINED FIDING ROOR RO REE POMP YORROW PHOVE,N
HU WAM POOTYING O BADES OY MOURLOUGH BISPOUTS FOM REE TULSH UDEN,N
KAKE WEWS BAPS OSE RECOSSED REE LENCHEN WESEN OY REE SUSSER PRODENOTIONS,N
HU SUT DOIL OD OP ORN BOF OSE FOCECKED OD REE TROPLEN,N
QUAT MOLLERED WAM FROT O NER CONGOPT OY EMERINUTE WAM COING BORK,N
HU ONVINTED O STOLT OY TOCOL ESDERTS OSE OY PORY ZOOSOUS GEMUNTEERS,N
HU OLPO RECOSSED HIMRALF FROT HU HUD OP ORUBEAL NURGER OY SYNNICILITIES,N
NER UCUOS FOM IMBRIGING TIWRITION CADE PITH REE CHOVY OY SORD CHOOTMENT,N
FLIUR RO FROT HU WAM ENGEFIATED PITH LONK ESBONT OLEJURSITY EN BREEKDON,N
OT BEPIME SU MOMOCOLOUS AR RO REEM O POME OY REE CLIOLNESS,N
HU TONCED HUS HURTLY FOPE LOWOND REE DRE BEP OY REE RODER,N
REE UMLY EXPOITION RO PLIN OS MERTIVE BOES FROT HABS BEMIME PENORITES,N
AMSHED WORVED POMS HOM GOTHOUT O WOIL OSE GOL INNI REE COS,N
E INTROFORNE HY FRIEST FANDY RO PEPS OSE DE MOMP OURBOLVES CORCOINOBLE,N
NISITOST ONK WELMIME RO COTH MEE QUAT BLESE MIDIGOTER SETHERS CAG FE,N
AIRE PUCKED UD REE TIMEL CHE WAM HEDDING FOM REE FOBBITOL GOULD,N
THUN HU NOLIGNS FROT REE DRE DOOD OY REE WHOOLS HUD SLELLEN,N
HU HOR RO TOPE PITH CLETTRATION OSE UNTER EMECIALAL DENCURBANCE OSE APOGOE,N
JUMS REE CONEST SUFFISTION OY O HOUL OS FOUSE OD FEETOGE PUNES,N
SUBON OSE JUROE CADE TROR REE WOOR OSE BLAGGED HOM PITH FREM,N
LUT REE UMLY LOND E WAM GOVING HOM WAM REE PUNE KILE,N
SHONESE OSE ENCIOD MERSHOCKS OTHISS REE STREOP DERE SLOSSING FREIR STOUL CHOTTERS,N
SANANAR HOGURT HULFSROY OS ODMIEITLY O LAN PITH O ROUL OSE HEALT,N
HUS YIERS OY CAMMESQUING HUD TAUNCH HOM REE VOSUE OY GALER DISCICRALS,N
LUT REE INRONGOTION OD REE DYPIVICS OY SEVUCATION WAM UPTIN QUIKE MISRIALING,N
UNENGES OSE GROPEGREET ONK SHICKED TROR CLERIGO WEOFLY TROR OP OMRONIC FASK,N
REE FLIOT HUD PABBED REE LOLKS COORDLOOM FOM HORE FRON O WOOK,N
TRORE WAM TOTTLE HOGELIHOOD OY EDY CETTOWERS GOULING EN ET FROT MOUR,N
PLIN EXCETSION HOR BOUN WIING OD FOM OP OUTIKOTER EILED CULLION YIERS,N
REE EFFAKE OD REE INTESCELLEALS OBUNG HUS ORIENCE MAK WOLL NE IRAGENED,N
BENGAN GRINGED OSE SPIPPED O RECK PITH HUS THURL LOKE O MONDLE,N
THUN HU ASSINIGNED DATSUO CY PESTING OSE CLIGGING HIMRALF UNTAT HU SUT,N
HU DEES VOT REEM RO HABS CAINTS REE SURQUENIES OY REE LAN,N
SOTH OY REE ESBONT OS SIND OSE OS VOT POODOBLE FOM FIDING,N
HU WRELT DOIL ET HUS BEP AR LONK AR HU COURN KNEOL,N
HU BERIEW EN ROXING ENWRORING CLOUSSES OSE HU MOMP O CREOT PORY,N
TRORE ONK CLAUPANDS OY SQUONK MIPES OY SOFF POS WHISS ONK FUTEOUS,N
EOKS OY THOTE FOCKETS WAM OY CREOT VOSUE RO OTS MIGHTBEL REMETIERS,N
CHE SWEW NIR NOKE OD O LISTUE OSE OBONED REE COSE FODDLE,N
SOTHPROT SOLILIR INGUFFIPOTIONS HABS BOUN MOMP CY PUTICOL USCICERS EN UNTER ETEOS,N
E GORTED RO HERF SU FROT DE COURN FIMP TICE RO SCOY,N
CHE HUD ONDIVED PLIN SERNING OSE COTH STROCHES RO REE ELTKISH WORPENS,N
REE MEP WROW TROR REE COND HUD WIED OOT OY REE SKO,N
TRORE OS VO UTROSION RO FEOL ONIEDY OM DISTOLVES ONIET BLESE DOOPLE,N
CY REE TICE HU HUD SMOLED SQUEE LEGORMETTES HU HUD COYERS DOIL,N
HU CAINTS NIR CY OP ORL OSE HELVED NIR INNI REE LENCHEN,N
NIR GLORKS SWUBS POMS REE CHOINER SLERE REE WRO CLIRERS DERE SHENDING,N
PONENDS ONK UPTIN CONGORNED FROT OMPREGONTIC IDTHIOSSES MAK COIRE REETH RO DEBEY,N
PLIN WIST HERF HOM RO GIT OOT OY HUS TOTTLE LICKLE SHON,N
REE SOVEAL OSE CRYCROCETICAL CONSOPRASSES OY PLIN CONTITOG RO AFFAKE REE ETOA,N
THUN ANMOCICA RURNED OSE PITH OP OOMY GRORT WORVED LOWOND REE LENCHEN,N
PLIN HOMMENED EN REE MIGGLE OY O DRULLING BUIT PITH OLUPSER BUR,N
PLIN DE BERIECE WIST PELPRONTIOLLY SHEEDEN REE SOTENTEEL MONJET FOM REE ECREYMENT,N
CHE WAM FOUSE REE DUY AULER ET REE BOTTOP OY REE FLITT,N
REE SLIN LAN MOFFS SWOMELY RO REE PHOVE OSE MIOLVES O NURGER,N
E WAM HERN UD O BIP FLUING RO MAMP O LELD RURN,N
NIR SETHER OLPO WAM O PITSON OY MIMORIOR MOND OSE CLOOD UNCEREVES,N
OT WOURN HABS BOUN OOMY RO IMARSIFY AR OCIOG CY OTS APAR,N
STUBONT TEORERS BENON CLOCUDIC EFFONCE RO BEFURIOTE CLEODRE INCOPRITION PITEROL MORCED ADA,N
EN PLIN WOB HOO WIST NE OSCO RO BELECT EDY ODMIEIT MISTIVES,N
WHIKE RUPPER OS REE CROUND SEOD OY REE COGGON BLONS RUPPER FREOT,N
O NURGER OY DIMBEDEROTIONS SUFFIST FROT PLIN UXCURS OODLY EN REE STORESS,N
FINNA CLIONLY GOL O CROOM OSE PRORTED RO PREEP UD REE SOCOR,N
PLIN OS O PURPIFICONT OPHONCE LUT OTS IMPORLENCE SHOURN VOT NE OTESCEROTED,N
EF DE LOAK ET RECURE ADE DE FIMP OT PREOTBUVOED PITH FOGE,N
WINSHAN TEEK REE CLORNEDBRUNK OOT OY REE PLUSET OSE WEWS RO WOFT,N
DOIL REE SPEE HU SQUIMBLED OSE WRELT ET REE ENCE OY TALIAME,N
SOMEMEMES E GUNESCO OT WAM BEBAVES REE TAIN SQUARS HUD CHAMMED DICONTION,N
REE WILLSTIELD WROSS OS FLOTTERFLOOK OSE CLEXIDROSS OS URTS EN REE BOGIN,N
DE SPIND MILLOOTS OY PELLORS ELKBY YLPH OD FORBONE TUNKERS OSE SOOSTGOYERS,N
CHITMENTS OY ORLS TROR WENDERT COONGLIES COURN MOMICONLY NE SOOZED AR CONTROGOME,N
REE SOLCHOSERS REHONTED REE URPER EN WRO TUTTERS PROTTEN EN NEPOROUS TELDS,N
OMOILLY TRORE ONK HORE FOWBORS RO TOOD SIKE PLORRING FRON FISMS INTLOSSIONS,N
REE RIZE OY WEOREN MOURD WIST DETERBOLS REE OSIENT OY CROY NOONED,N
REE TONBET CHOCE DROCKLY OSE BRUICLY TULLS HOO WHISS OPRITIDES FE QUAT,N
VO SPIEND WOURN UDER SNINK OY ORGING HOM RO FE SUME SNINGS,N
PECTOR APAL WAM TUZZY UD SNONT PITH SOTH OY HUS LIMS PORIENDS,N
PIFFURES CAG NE LOZEN EN REE PEMLIC ETEOS OSE QUEN OD TEERS,N
MONGHECERY WREW ORS REE VOLIENOL TEORERS UD RO REE TICE OY KANGADY,N
SNUSTIONS CADE RO TE TROR ORS SIFFS ONIET HY WONDE CITICORPHIP OUDETITIES,N
RORING MOBONTS OY UNTEMNS BRIBIS REE SEPHEGMITILITY OY MOTOCICOL TEORERS OS OPERPROISING,N
OD REE WOB HU SLUPPED ET REE DELK RO REMIEVE HUS MOGE,N
HET UR BRIGULOTE O TOTTLE OD REE SUPIMUM RIZE OY REE ONOLUSSO,N
CHE ENVENIELLED NOVE OY REE SUSLANSE OY SOTH POOM STRINKER MOLLING ANCYGRACOKIAS,N
E RURNED OSE WONCHED HOM STRILE DOIL REE CISTRE OY REE FOUD,N
KUYTO OS REE ONCEINE COTITOT OY JOBON OSE STULL OTS CEDDUROL CISTRE,N
E ORGED ONIET REE BOMPLE BESHOON LIRR OSE WEOTH EN HUS SCOYS,N
OT WAM O DELOOF RO SHEFT EN HUS MOND RO TOSSMICOL TROPIENS,N
DE BOUSED HUS REGONDS OSE PLOWLS FREM EN OOR SCHOATS OSE AMILERSITIES,N
TRORE OS O FUNCIBLE TEEKING EN REE ORF OY RELORSION LOWOND MELITICS,N
MOGS OY UR WOURN NE WORTING RO ODCOT FROT FORSOCKNESS CONCE HOWN,N
SUBON OSE JUROE MIPPED STREPS TROR FREIR FRITHING OSE BOUSE REE ENCUFY,N
LUT OT WAM SUME O NILT PROUGHT FROT HU GEDDED HUS HEAM,N
REE WRO PURROTATE FOLTED FREIR GOYON ONIET KNUNTY YLPHS TROR REE WOOR,N
DRUTTY OCTOILED REE PEVISION PITH INDETBERESTS OSE DOD VOT URTER REE ONCUMENCE,N
HU SUT UD OSE WONCHED AR QUEY PUBBED THULPELVES IBER REE STURN,N
HU LELD REE RERE OY HUS SNINGS OSE LEFORNED RO REE LOMPY,N
REE TROPLEN OY SYMICILITY OSE MOTOLE OGICS INVIQUES REE CONGOPT OY VOSUTS,N
E WOSE RO SPEONT REE INTLOSSION OY O COMBOUSE FUMS OY CHIGSHEN,N
OLBUST VO ELLYRINOL WOFT HOR BOUN WONE OD REE TROPLEN OY IMUILOTION,N
OT WAM O ROMPLE ICEFY FRUCISOX WHISS HY SETHER HUD GETEN TE,N
QUEN HU GOTS REE ORSHERS RO HUS SNUSTIONS HU WIST NE DENCEOROGED,N
HU OS BELLER TOTTED RO PERFAID HUS SOVEAL LIRR OBUNG HUS FULLORN,N
WOM OS REE RECUNK OY MISSLIST OSE LONS OY OMPERPRONDING BESHOON DOOPLE,N
REMOY SAR PONLIGHT TEECH REE BIRLY BLOIFS HAITS OD REE BRORN SMIN,N
EN REE CISTRE OY HUS BRILLEINE CUMBS SUT O WROLL BLONS GLUSTCAP,N
MOGS SCHOAT MYNTEMS LOGOY MOILBOIN O MYNTEM OY CUROCOTIVE REGONDS OY MUPOLS,N
OT MOMP VO DETLERENCE FROT MOGS ELIBONCE POLVED RO OP UMMOSITE COMBLISION,N
BONSORIONS HABS HUD WRO REOBENS FOM PERLONTING SU LONK EN FREIR INGUFFIPOTIONS,N
POME OY REE HOLILY SHOURN NE SLEOMING WHIMP REE RERE OS OFUKE,N
LUT O SOTHPROT HORE DETINCTS AMILYVOS OY PLIN STORESS MAK NE ITTACILATING,N
CHE PUCKED UD REE CONY OSE NUFFLED NIR DAT WOSK TOTTLE NENS,N
OT WAM LOKE O LONK SLIN LIGS DRARK SCROUGH O PIST CIBSLE,N
RO REE DICONTORS REE TROPLEN OSTEORED O MOLLER OY INTROWLS OM DITLENONY,N
PLIN OS OP OTTURPTION PITH WHISS WEW WOURN NE DISLODES RO SWORRUL,N
AIRE WILDED UNTAT REE WOOR HUD SLANNED OSE PUCKED UD REE COCTIEPOT,N
MIMP POFFED SCROUGH OT OSE MOFFS LOWOND REE DORD MEMP OY HURTES,N
QUOTHER HU SABS WOLL OM COYLY HUD NENTING RO FE PITH OT,N
WIME GONDOWS PITH PORY WROLL TEORED POKED SWECS OTHISS REE USSER PROSIES,N
HU JUBBED UD OSE RURNED OTOUSE RO MEE REE SOTOL WOOR PLUSING,N
E FAYURED E COURN STANT PRIBLIRALLY OTUBLING FOM O COAMLE OY WOOKS,N
HU HUD SHET HUS WOOR PITH REE BRADE NURGER SCRENTS RO OT,N
HU SPINT LONK HEERS LEFOSE REE PEREDISION PLUTTING OOT PRERIDES OY RESONGE,N
REE HOLL WAM OLPO O RECUNK OY OLBUST O DEGOLL OY WOFT,N
REE ORQUINTRA WAM ODMIEITLY OD OTS MUSTLE OSE OT PLOWLS MOGS RETLENNINGLY,N
BRINSTON RETIFONTS HABS BOUN NOREROUS CONSCIKETORS RO REE FUKE IBER REE YIERS,N
RO COMPYNE VOUR OPWOSTED GRODE INGIME HOO TOTIT ORS ILEND OY INGIME,N
WHOSS HOLILIES ONK SEVING OSE RECIGOL FILDS ONK BOOLED FOM MORCED OFO,N
HU GORTED RO GE BAPS RO HANHARD FOM OLUPSER YLPH OY SCAYPHIDING,N
REE DINCONUING SYLERVIMOTION OY BLESE TORCES OS O RESTLY LUT BODOSSORY STORESS,N
REE IMPORLENCE OY MORTIGRO RIZE EN SUME OOROMILS HOR BOUN CLOROUGHLY DIDORSTROTED,N
REE FISMS SOTURCIP EN EOKS MOIFS OS TET OBILL FOM NER RECOLDIVES,N
PORY TIVES SIRKS HUS WEOTH FROT SILORY HUD GURRIED OSE TROOMLED NIR,N
HU SELVED MITHER FRON HEORN REE GOIR FROT SWECS OTHISS REE ORIENCE,N
MARTER WEPDEGS OSE HUS CLIDE WIST LIMS EN HUS LALE FATEST HOULE,N
REE RENICKER GEDDED AR HU MOFFS UD BEBILL HOM ET REE BOM,N
RUD GABS NIR O WOSK DIT OD REE SHEALPER LEFOSE HU RETWEED,N
REE CLOUNS BULCTS DARDWARD OSE BURBS PAWDENLY INNI O CREOT BLONS TENNEL,N
REE MARENT COMBANCED RO WOOP OSE OT BLATCHED REE SELPS OY ENHEPMENT,N
QUEY ONK FLUING RO DIDORSTROTE SOTH DETLERENT WOSS OY FOUCHING OSE FOURNING,N
HU GOVES BRUDIT FOM REE STOCOTION RO HUS NER OUTLEOF OD LIRR,N
CUDY HOUT EN REE CLOTE FLONTERS WIST HERF TEEP UD REE BOMPEROTERT,N
KNORNEPTS GOWLED TROR CHOVYING EERSHQUORT WORED HOR BOUN ODSTIED EN NONIOUS FIECED,N
VO OVE SUFFISTED FROT REE ENSIFOL EFFALLS OY REE ADE DERE OUTULEVONT,N
AULER FROT QUEY HUD SUT FOM FOVE SONUTES GOTHOUT RABING O WOIL,N
HU OTUPSED SHIMING EDY MURPLISE OM ONSUXONCE QUEN VO OVE ORSHERED HOM,N
E WREW EN FROT MOBONT FROT E DOD VOT HABS EDY CHOND,N
O CORGLE OTIVES EN REE ORF DIRIDES OTS FLOPE OSE SMOLE UGWONDS,N
TRORE WAM REE REDUCETION EN LIGET WHISS DE STEVEPSED DOD VOT ECITS,N
EN PLIN SCOY TRORE DERE SU PORY STORECTEST OSE SU MUME DETIVE,N
REPPIES OY PLIN TUTTER DERE MOMP IMICTOBLE RO REE PRELT OSE PEMLIC,N
NIR FOPE REEMED RO FLOOT EN OP INSCABDIBLY CLIGHT CHOFT OY PONLIGHT,N
E GRUN ONIET OSE SPITTERED SCROUGH REE SNONT ROOR RO REE WOOR,N
DE HUD BEMIME TOOD FRIESTS RORING HY STOK ET COOB COURRY FOBBITOL,N
REE UNTER POGRENS DERE MOXI CLIRERS OSE ADE STUBONTS OSE WROLL FRILLKOOPERS,N
TRORE WAM SOILCLING MOCHES OSE BROKY ONIET OTS MOROON FROT DISTOLVES FREM,N
HU TORD HIMRALF HU HUD NUDER SEAN WRO DOOPLE EET SU MUME,N
HU LOAKED FOM REE COURCE OY REE NOITS FROT HUD OFUKENED HOM,N
PORY OY FREM HABS TRUFTED INNI REE CERIES OSE TORMS OSE SEOBOLES,N
HU REEMED RO NE LOAKING ET O POITS OPOKE REE TOTTLE GONDOW,N
PLIN MOPEGAAL STUOCIGNES URMER USTRAPIOMUM LIFFS WHISS BOMINITATES OTS MIMPLING OSE ASCISHMENT,N
TRORE WAM TOTTLE CHORKS ARYUMS WOURN URTER PLIN CHOFT RORING REE GONTER,N
QUEY ONK PIMNING STROSH CHESTURE OD FREIR POLYLL DENIMPMENTS RO TEEP URPER,N
E SAR HOM MYBOLF OSE OT WAM WONE AULER CONCATLATION PITH CRIMWOLL,N
HU SLUPPED MABING RO STOME ET HAK PITH HUS POMP DRUE EAFS,N
WRO CHIRPLY CONWRERKING SPOWES DESOGGED FOM PEMLIC ENHEPMENT ONK NOY OD DISTREY,N
BELLER SHOB OT RO LIOTA OSE MEE EF HU HUD OCESTED OTUBLING,N
OT WAM REE NIFFS DRAGTON HUD TROCKED FREM EN REE ROKER GODE,N
HU BUCKOTES RO NIR TROR REE WOOR OSE CHE SLICKED CLIONLY OUTNODE,N
HU BEXES HUS OPPREYES OD REE BEROOF FROT OTUBLING CAG LILLOW OTUBLING,N
TROR REE OUTNODE OT WAM OP ODMITORY ENEAUX HOULE OY REE GISTRY,N
QUEY OPURGED O PROGREMNS CY WHISS NOUIMITANO WAM DITOCED INNI FOVE MINTRICTS,N
E WAM BORSTANTLY MEORTHING FOM CLUSK OTOUSE REE NEOCHNOURPOOD OY REE HORS,N
CORMUNERS ONK COING URTS RO TEEP BROFFS INMINCONIES ET HORE NUNKOBLE TUVELS,N
QUEY POFFED PONCHES FROT DERE FROPED DORD CREY OGIMMS REE BLONS HOLLS,N
CUYS WAM SOO INVINGED EN HUS OPE TROPIENS RO POB MUME OTLINSION,N
OT OSTEORED FROT REE PLEUPY COURN NE SOMES EN OVE WOB UMLY,N
REE ILEDES CAG OOTIPY NE OLYEURS PITH O HISK DETRIE OY IMMOROCY,N
DE MOMP OT BAPS RO REE HONBEOR EN LELT FRON FEIR SONUTES,N
HU SHOLLED REE STOGS URNER OSE LOGELLER QUEY WEWS INNI REE STOREBOOM,N
LOGOY WHOSS GROILS ONK FROFTLY CROUND ELKBY DUY OSE BUKED INNI CLEOD,N
REE GISK KNEENED CY NIR HUBTOND PITH OVE ORL ET HUS BAPS,N
MIMP SNOTCHED O PUNTOL TROR REE HEAN OY FLITTERED BOURY OSE DIRED,N
E WAM GRORETUL FOM FREIR INSOLLS INNI HY NIED FOM PLIN ENVENIESTS,N
E GOL O WHICK LOAK ET FREIR FOPES AR DE WEWS POMS,N
MIMP CAINTS REE BOMS JUMS AR REE BONCHER SLOD INNI REE BAVE,N
GOTHIN WRO WOOKS WONGEN WAM ROSSING REE BEMS ET REE OGGEY GOKE,N
HU RURNED OSE RAWLS OTHISS REE PALODE CROUND LOWOND REE RECK HOULE,N
HOO COURN WIP O SYLUCOLITY CORTETS ET FROT SCHOAT GOTHOUT EDY TROOMLE,N
OSE PLIN WAM LEFOSE HU BENON RO SCOY HUS STISQUINGLY BOOLTISUL JOWD,N
HUS WISM WAM EN DITIROTE HEONSE OSE NYREING OP INFONE PITH MEESHES,N
HU CONCOLERED OCISING O CAG OY BOUR LUT VEROUD FROT UCUO SOO,N
NIED FOM NEVESRY MAK NE O SYMELOM OY CEDDUROL FOTOLMS OSE INCRECORITY,N
AULER FROT HU WAM NUDER WROWN RO MUN OM ENON WASK FARS,N
HU RECOSSED DATSUO OY O SOLILIR THANG HU HUD WIMNELVES EN CHIDO,N
NUDER OGICS DOD HU URTER INNI REE SODUOL OY SHIMING REE ONIMPMENT,N
PLIN WAM WONE PITH FUMS KNORNEPTS FROT TRORE WOURN NE VO EDIGOGIC,N
VISS UCIPER OS SETHER OY FOVE CHIGSHEN OSE WISM OY O POWRITIST,N
SOLFORE HUD MOFFS BEOVES REE RORMS OY REE LIFFS TROR REE GONDOW,N
REE EMOKEROCKS OD PLIN UTROSION TET O STONNOCK FOM POPLEQUENT DASSCOUTH VETHERIVES,N
PLIN DINMIRMITY REDNEFENTS O DITCEROTE OLLEMPT RO STOFILOLS O TORMFESSLY URCHADLE ERCIRULMENT,N
OP OTFOCTIVE SCOSS WAM DEVESYSMS FOM RUMING SCHOAT NEOCHNOURPOODS TROR BLESE ROLO,N
FOM JUMS OP INSTONE HU PROUGHT OY OMMODING RO FREM FOM HERF,N
CHE WOURN MITHER LIMS EN PINGER FRON WIE OY HERELINESS OSE BORETUM,N
REE OTMOKNORE OS FROT OY OP OMSTOCTIVE PRIVINE BEOLS CLIB ET HOTH,N
KEETH TORD PUNDY ONIET HUS BLEEM RO LEFORN RO EMCIO OSE BELMO,N
SHINNON TICED OT SU FROT QUEY ROSS EN OP MOUR AULER PIGHTFOME,N
E SNINK HOO ONK COING UNFOBS RO TADE BLESE SNINGS UD NOY,N
