Unnamed: 0.18,Unnamed: 0.17,Unnamed: 0.16,Unnamed: 0.15,Unnamed: 0.14,Unnamed: 0.13,Unnamed: 0.12,Unnamed: 0.11,Unnamed: 0.10,Unnamed: 0.9,Unnamed: 0.8,Unnamed: 0.7,Unnamed: 0.6,Unnamed: 0.5,Unnamed: 0.4,Unnamed: 0.3,Unnamed: 0.2,Unnamed: 0,Unnamed: 0.1,Unnamed: 0.1.1,Unnamed: 0.1.1.1,Unnamed: 0.1.1.1.1,Unnamed: 0.1.1.1.1.1,Unnamed: 0.1.1.1.1.1.1,Unnamed: 0.1.1.1.1.1.1.1,Unnamed: 0.1.1.1.1.1.1.1.1,Unnamed: 0.1.1.1.1.1.1.1.1.1,Unnamed: 0.1.1.1.1.1.1.1.1.1.1,Unnamed: 0.1.1.1.1.1.1.1.1.1.1.1,Unnamed: 0.1.1.1.1.1.1.1.1.1.1.1.1,Unnamed: 0.1.1.1.1.1.1.1.1.1.1.1.1.1,Unnamed: 0.1.1.1.1.1.1.1.1.1.1.1.1.1.1,Unnamed: 0.1.1.1.1.1.1.1.1.1.1.1.1.1.1.1,Unnamed: 0.1.1.1.1.1.1.1.1.1.1.1.1.1.1.1.1,Unnamed: 0.1.1.1.1.1.1.1.1.1.1.1.1.1.1.1.1.1,Unnamed: 0.1.1.1.1.1.1.1.1.1.1.1.1.1.1.1.1.1.1,Unnamed: 0.1.1.1.1.1.1.1.1.1.1.1.1.1.1.1.1.1.1.1,Unnamed: 0.1.1.1.1.1.1.1.1.1.1.1.1.1.1.1.1.1.1.1.1,Unnamed: 0.1.1.1.1.1.1.1.1.1.1.1.1.1.1.1.1.1.1.1.1.1,Unnamed: 0.1.1.1.1.1.1.1.1.1.1.1.1.1.1.1.1.1.1.1.1.1.1,Unnamed: 0.1.1.1.1.1.1.1.1.1.1.1.1.1.1.1.1.1.1.1.1.1.1.1,Unnamed: 0.1.1.1.1.1.1.1.1.1.1.1.1.1.1.1.1.1.1.1.1.1.1.1.1,Unnamed: 0.1.1.1.1.1.1.1.1.1.1.1.1.1.1.1.1.1.1.1.1.1.1.1.1.1,Unnamed: 0.1.1.1.1.1.1.1.1.1.1.1.1.1.1.1.1.1.1.1.1.1.1.1.1.1.1,Unnamed: 0.1.1.1.1.1.1.1.1.1.1.1.1.1.1.1.1.1.1.1.1.1.1.1.1.1.1.1,Unnamed: 0.1.1.1.1.1.1.1.1.1.1.1.1.1.1.1.1.1.1.1.1.1.1.1.1.1.1.1.1,Unnamed: 0.1.1.1.1.1.1.1.1.1.1.1.1.1.1.1.1.1.1.1.1.1.1.1.1.1.1.1.1.1,Unnamed: 0.1.1.1.1.1.1.1.1.1.1.1.1.1.1.1.1.1.1.1.1.1.1.1.1.1.1.1.1.1.1,Unnamed: 0.1.1.1.1.1.1.1.1.1.1.1.1.1.1.1.1.1.1.1.1.1.1.1.1.1.1.1.1.1.1.1,Unnamed: 0.1.1.1.1.1.1.1.1.1.1.1.1.1.1.1.1.1.1.1.1.1.1.1.1.1.1.1.1.1.1.1.1,Unnamed: 0.1.1.1.1.1.1.1.1.1.1.1.1.1.1.1.1.1.1.1.1.1.1.1.1.1.1.1.1.1.1.1.1.1,Unnamed: 0.1.1.1.1.1.1.1.1.1.1.1.1.1.1.1.1.1.1.1.1.1.1.1.1.1.1.1.1.1.1.1.1.1.1,Unnamed: 0.1.1.1.1.1.1.1.1.1.1.1.1.1.1.1.1.1.1.1.1.1.1.1.1.1.1.1.1.1.1.1.1.1.1.1,Unnamed: 0.1.1.1.1.1.1.1.1.1.1.1.1.1.1.1.1.1.1.1.1.1.1.1.1.1.1.1.1.1.1.1.1.1.1.1.1,Unnamed: 0.1.1.1.1.1.1.1.1.1.1.1.1.1.1.1.1.1.1.1.1.1.1.1.1.1.1.1.1.1.1.1.1.1.1.1.1.1,Unnamed: 0.1.1.1.1.1.1.1.1.1.1.1.1.1.1.1.1.1.1.1.1.1.1.1.1.1.1.1.1.1.1.1.1.1.1.1.1.1.1,Unnamed: 0.1.1.1.1.1.1.1.1.1.1.1.1.1.1.1.1.1.1.1.1.1.1.1.1.1.1.1.1.1.1.1.1.1.1.1.1.1.1.1,Unnamed: 0.1.1.1.1.1.1.1.1.1.1.1.1.1.1.1.1.1.1.1.1.1.1.1.1.1.1.1.1.1.1.1.1.1.1.1.1.1.1.1.1,Unnamed: 0.1.1.1.1.1.1.1.1.1.1.1.1.1.1.1.1.1.1.1.1.1.1.1.1.1.1.1.1.1.1.1.1.1.1.1.1.1.1.1.1.1,Unnamed: 0.1.1.1.1.1.1.1.1.1.1.1.1.1.1.1.1.1.1.1.1.1.1.1.1.1.1.1.1.1.1.1.1.1.1.1.1.1.1.1.1.1.1,Unnamed: 0.1.1.1.1.1.1.1.1.1.1.1.1.1.1.1.1.1.1.1.1.1.1.1.1.1.1.1.1.1.1.1.1.1.1.1.1.1.1.1.1.1.1.1,Unnamed: 0.1.1.1.1.1.1.1.1.1.1.1.1.1.1.1.1.1.1.1.1.1.1.1.1.1.1.1.1.1.1.1.1.1.1.1.1.1.1.1.1.1.1.1.1,Unnamed: 0.1.1.1.1.1.1.1.1.1.1.1.1.1.1.1.1.1.1.1.1.1.1.1.1.1.1.1.1.1.1.1.1.1.1.1.1.1.1.1.1.1.1.1.1.1,Unnamed: 0.1.1.1.1.1.1.1.1.1.1.1.1.1.1.1.1.1.1.1.1.1.1.1.1.1.1.1.1.1.1.1.1.1.1.1.1.1.1.1.1.1.1.1.1.1.1,Unnamed: 0.1.1.1.1.1.1.1.1.1.1.1.1.1.1.1.1.1.1.1.1.1.1.1.1.1.1.1.1.1.1.1.1.1.1.1.1.1.1.1.1.1.1.1.1.1.1.1,Unnamed: 0.1.1.1.1.1.1.1.1.1.1.1.1.1.1.1.1.1.1.1.1.1.1.1.1.1.1.1.1.1.1.1.1.1.1.1.1.1.1.1.1.1.1.1.1.1.1.1.1,Unnamed: 0.1.1.1.1.1.1.1.1.1.1.1.1.1.1.1.1.1.1.1.1.1.1.1.1.1.1.1.1.1.1.1.1.1.1.1.1.1.1.1.1.1.1.1.1.1.1.1.1.1,Unnamed: 0.1.1.1.1.1.1.1.1.1.1.1.1.1.1.1.1.1.1.1.1.1.1.1.1.1.1.1.1.1.1.1.1.1.1.1.1.1.1.1.1.1.1.1.1.1.1.1.1.1.1,Unnamed: 0.1.1.1.1.1.1.1.1.1.1.1.1.1.1.1.1.1.1.1.1.1.1.1.1.1.1.1.1.1.1.1.1.1.1.1.1.1.1.1.1.1.1.1.1.1.1.1.1.1.1.1,Unnamed: 0.1.1.1.1.1.1.1.1.1.1.1.1.1.1.1.1.1.1.1.1.1.1.1.1.1.1.1.1.1.1.1.1.1.1.1.1.1.1.1.1.1.1.1.1.1.1.1.1.1.1.1.1,story,question,filename,condition,response,extracted
0,0,0,0,0,0,0,0,0,0,0,0,0,0,0,0,0,0,0,0,0,0,0,0,0,0,0,0,0,0,0,0,0,0,0,0,0,0,0,0,0,0,0,0,0,0,0,0,0,0,0,0,0,0,0,0,0,0,0,0,0,0,0,0,0,0,0,0,0,0,"Expecting the game to be postponed because
of the rain, the Garcia family took the
subway home. The score was tied, 3-3.
During their commute the rain stopped and
the game soon ended with a score of 5-3.","The Garcia family arrives home 
believing the score is 5-3.

False  or  True?",1b,belief,False,False
1,1,1,1,1,1,1,1,1,1,1,1,1,1,1,1,1,1,1,1,1,1,1,1,1,1,1,1,1,1,1,1,1,1,1,1,1,1,1,1,1,1,1,1,1,1,1,1,1,1,1,1,1,1,1,1,1,1,1,1,1,1,1,1,1,1,1,1,1,1,"Accounts of the country's bustling economic 
success were recorded in both fiction and non-
fiction books from the early 1900s. Soon 
after, a horrible plague hit the country and 
the country was sent into an economic depression.","Early 1900s novels portray the 
country as experiencing economic 
wealth.

False or True?",1p,photo,True,False
2,2,2,2,2,2,2,2,2,2,2,2,2,2,2,2,2,2,2,2,2,2,2,2,2,2,2,2,2,2,2,2,2,2,2,2,2,2,2,2,2,2,2,2,2,2,2,2,2,2,2,2,2,2,2,2,2,2,2,2,2,2,2,2,2,2,2,2,2,2,"The morning of high school dance Sarah
placed her high heel shoes under her 
dress and then went shopping. That 
afternoon, her sister borrowed the shoes
and later put them under Sarah's bed.","Sarah gets ready assuming her 
shoes are under the dress.

False or True? ",2b,belief,True,False
3,3,3,3,3,3,3,3,3,3,3,3,3,3,3,3,3,3,3,3,3,3,3,3,3,3,3,3,3,3,3,3,3,3,3,3,3,3,3,3,3,3,3,3,3,3,3,3,3,3,3,3,3,3,3,3,3,3,3,3,3,3,3,3,3,3,3,3,3,3,"Sargent famously painted the south bank of 
the river in 1885. In 1910 a huge dam was 
built, flooding out the whole river basin, 
killing the old forests. Now the whole area 
is under water.","In the painting the south bank of 
the river is wooded. 

False or True? ",2p,photo,True,False
4,4,4,4,4,4,4,4,4,4,4,4,4,4,4,4,4,4,4,4,4,4,4,4,4,4,4,4,4,4,4,4,4,4,4,4,4,4,4,4,4,4,4,4,4,4,4,4,4,4,4,4,4,4,4,4,4,4,4,4,4,4,4,4,4,4,4,4,4,4,"When Lisa left Jacob he was deep asleep 
on the beach. A few minutes later a 
wave woke him. Seeing Lisa was gone 
Jacob decided to go swimming.","Lisa now believes that Jacob is sleeping.

False or True? ",3b,belief,True,False
5,5,5,5,5,5,5,5,5,5,5,5,5,5,5,5,5,5,5,5,5,5,5,5,5,5,5,5,5,5,5,5,5,5,5,5,5,5,5,5,5,5,5,5,5,5,5,5,5,5,5,5,5,5,5,5,5,5,5,5,5,5,5,5,5,5,5,5,5,5,"At the time a portrait was drawn of a 
young man, he had short brown hair and 
no facial hair. Now the man's hair is 
long and gray and so is his beard.  ","Today the length of the man's hair 
is long.

False or True? ",3p,photo,True,False
6,6,6,6,6,6,6,6,6,6,6,6,6,6,6,6,6,6,6,6,6,6,6,6,6,6,6,6,6,6,6,6,6,6,6,6,6,6,6,6,6,6,6,6,6,6,6,6,6,6,6,6,6,6,6,6,6,6,6,6,6,6,6,6,6,6,6,6,6,6,"John told Mary that he had lost his keys. The 
two of them searched the house with no luck. 
Then Mary went outside to look in the car. 
Suddenly John noticed his keys behind the sofa.","By the time Mary comes in, John 
doesn't know where his keys are.

False or True? ",4b,belief,False,False
7,7,7,7,7,7,7,7,7,7,7,7,7,7,7,7,7,7,7,7,7,7,7,7,7,7,7,7,7,7,7,7,7,7,7,7,7,7,7,7,7,7,7,7,7,7,7,7,7,7,7,7,7,7,7,7,7,7,7,7,7,7,7,7,7,7,7,7,7,7,"A biography describes the room as it was 
in 1965. Originally the walls were covered 
in dark wallpaper. By 1965 the paper had 
been stripped and replaced with cream paint.","The biography says that the room 
was light.

False or True?",4p,photo,True,False
8,8,8,8,8,8,8,8,8,8,8,8,8,8,8,8,8,8,8,8,8,8,8,8,8,8,8,8,8,8,8,8,8,8,8,8,8,8,8,8,8,8,8,8,8,8,8,8,8,8,8,8,8,8,8,8,8,8,8,8,8,8,8,8,8,8,8,8,8,8,"Susie parked her sportscar in the driveway. 
In the middle of the night  Nathan moved 
her car into the garage to make room for 
his minivan. Susie woke up early in the morning.","Susie sees the minivan in 
the driveway.

False or True? ",5b,belief,True,False
9,9,9,9,9,9,9,9,9,9,9,9,9,9,9,9,9,9,9,9,9,9,9,9,9,9,9,9,9,9,9,9,9,9,9,9,9,9,9,9,9,9,9,9,9,9,9,9,9,9,9,9,9,9,9,9,9,9,9,9,9,9,9,9,9,9,9,9,9,9,"The girl's middle school pictures showed 
her wearing a white blouse. Later, a 
red sock was accidentally washed with 
the blouse and the blouse turned pink.  ","Today the color of the blouse is white.

False or True? ",5p,photo,False,False
10,10,10,10,10,10,10,10,10,10,10,10,10,10,10,10,10,10,10,10,10,10,10,10,10,10,10,10,10,10,10,10,10,10,10,10,10,10,10,10,10,10,10,10,10,10,10,10,10,10,10,10,10,10,10,10,10,10,10,10,10,10,10,10,10,10,10,10,10,10,"A window wiper was commissioned by a 
CEO to wipe an entire building. He 
finished the right side, but his 
platform broke before he could do the 
left side. The next morning the CEO 
arrived with foreign investors.","The CEO comes to work and discovers  
that all of the walls are cleaned.

False or True? ",6b,belief,False,False
11,11,11,11,11,11,11,11,11,11,11,11,11,11,11,11,11,11,11,11,11,11,11,11,11,11,11,11,11,11,11,11,11,11,11,11,11,11,11,11,11,11,11,11,11,11,11,11,11,11,11,11,11,11,11,11,11,11,11,11,11,11,11,11,11,11,11,11,11,11,"A long time ago, an explorer mapped a 
small island. Since then, the water 
levels rose and only a tiny part of the 
island is now left above water.","On the explorer's maps, the island 
appears to be mostly submerged.

False or True? ",6p,photo,False,False
12,12,12,12,12,12,12,12,12,12,12,12,12,12,12,12,12,12,12,12,12,12,12,12,12,12,12,12,12,12,12,12,12,12,12,12,12,12,12,12,12,12,12,12,12,12,12,12,12,12,12,12,12,12,12,12,12,12,12,12,12,12,12,12,12,12,12,12,12,12,"Sally and Greg called ahead of time to make 
a reservation for the back-country cabin. 
The park ranger forgot to write down the 
reservation and two other hikers got to the 
cabin first.","When the hikers arrive they see no 
one in their cabin.

False or True? ",7b,belief,False,False
13,13,13,13,13,13,13,13,13,13,13,13,13,13,13,13,13,13,13,13,13,13,13,13,13,13,13,13,13,13,13,13,13,13,13,13,13,13,13,13,13,13,13,13,13,13,13,13,13,13,13,13,13,13,13,13,13,13,13,13,13,13,13,13,13,13,13,13,13,13,"When the picture was taken of the house, 
it was one story tall. Since then, the 
renovators added an additional story and 
a garage.","The house is currently one story.

False or True? ",7p,photo,False,False
14,14,14,14,14,14,14,14,14,14,14,14,14,14,14,14,14,14,14,14,14,14,14,14,14,14,14,14,14,14,14,14,14,14,14,14,14,14,14,14,14,14,14,14,14,14,14,14,14,14,14,14,14,14,14,14,14,14,14,14,14,14,14,14,14,14,14,14,14,14,"Larry chose a debated topic for his 
class paper due on Friday. The 
news on Thursday indicated that the
debate had been solved but Larry 
never read it.  ","When Larry writes his paper he thinks 
the debate has been solved.

False or True? ",8b,belief,False,False
15,15,15,15,15,15,15,15,15,15,15,15,15,15,15,15,15,15,15,15,15,15,15,15,15,15,15,15,15,15,15,15,15,15,15,15,15,15,15,15,15,15,15,15,15,15,15,15,15,15,15,15,15,15,15,15,15,15,15,15,15,15,15,15,15,15,15,15,15,15,"A volcano erupted on a Carribean island 
three months ago. Barren lava rock is 
all that remains today. Satellite photographs 
show the island as it was before the eruption. ","Today, the island is covered in 
lava rock.

False or True? ",8p,photo,True,False
16,16,16,16,16,16,16,16,16,16,16,16,16,16,16,16,16,16,16,16,16,16,16,16,16,16,16,16,16,16,16,16,16,16,16,16,16,16,16,16,16,16,16,16,16,16,16,16,16,16,16,16,16,16,16,16,16,16,16,16,16,16,16,16,16,16,16,16,16,16,"Laura didn't have time to braid her 
horse's mane before going to camp. 
While she was at camp, William brushed 
Laura's horse and braided the horse's 
mane for her.","Laura returns assuming that her 
horse's hair isn't braided

False or True?",9b,belief,True,False
17,17,17,17,17,17,17,17,17,17,17,17,17,17,17,17,17,17,17,17,17,17,17,17,17,17,17,17,17,17,17,17,17,17,17,17,17,17,17,17,17,17,17,17,17,17,17,17,17,17,17,17,17,17,17,17,17,17,17,17,17,17,17,17,17,17,17,17,17,17,"A large oak tree stood in front of City 
Hall from the time the building was built.  
Last year the tree fell down and was replaced 
by a stone fountain.","An antique drawing of City Hall 
shows a fountain in front.

False or True? ",9p,photo,False,False
18,18,18,18,18,18,18,18,18,18,18,18,18,18,18,18,18,18,18,18,18,18,18,18,18,18,18,18,18,18,18,18,18,18,18,18,18,18,18,18,18,18,18,18,18,18,18,18,18,18,18,18,18,18,18,18,18,18,18,18,18,18,18,18,18,18,18,18,18,18,"Amy walked to work today. When George woke 
up, he saw her car in the drive. Her room 
was quiet and dark. George knows that when 
Amy is sick, she lies down in a dark room.","In fact, Amy walked to work.

False or True? ",10b,belief,True,False
19,19,19,19,19,19,19,19,19,19,19,19,19,19,19,19,19,19,19,19,19,19,19,19,19,19,19,19,19,19,19,19,19,19,19,19,19,19,19,19,19,19,19,19,19,19,19,19,19,19,19,19,19,19,19,19,19,19,19,19,19,19,19,19,19,19,19,19,19,19,"Old maps of the islands near Titan are 
displayed in the Maritime museum. 
Erosion has since taken its toll, leaving 
only the three largest islands. ","Near Titan today there are many islands.

False or True? ",10p,photo,False,False
20,20,20,20,20,20,20,20,20,20,20,20,20,20,20,20,20,20,20,20,20,20,20,20,20,20,20,20,20,20,20,20,20,20,20,20,20,20,20,20,20,20,20,20,20,20,20,20,20,20,20,20,20,20,20,20,20,20,20,20,20,20,20,20,20,20,20,20,20,20,"When they were children, Paul and Tom 
would swing on the trees in their garden. 
By the time they were teenagers, 
all of the trees had been chopped down.","Today, there are no more trees
in the garden

False or True?",11b,belief,True,False
21,21,21,21,21,21,21,21,21,21,21,21,21,21,21,21,21,21,21,21,21,21,21,21,21,21,21,21,21,21,21,21,21,21,21,21,21,21,21,21,21,21,21,21,21,21,21,21,21,21,21,21,21,21,21,21,21,21,21,21,21,21,21,21,21,21,21,21,21,21,"Jessie leaves her chemistry book at home. 
Her mother, knowing that she has a chemistry
exam that afternoon, brings it to school and 
leaves it in Jessie's locker. ","Jessie opens her schoolbag and takes 
out the chemistry book

False or True?",11p,photo,False,False
22,22,22,22,22,22,22,22,22,22,22,22,22,22,22,22,22,22,22,22,22,22,22,22,22,22,22,22,22,22,22,22,22,22,22,22,22,22,22,22,22,22,22,22,22,22,22,22,22,22,22,22,22,22,22,22,22,22,22,22,22,22,22,22,22,22,22,22,22,22,"In 2000, when the schoolhouse opened,
there were two classrooms and two teachers.
Now, there are twenty teachers and ten 
classrooms to accommodate the influx
of young families to the area.","Today, there are only two classrooms
in the schoolhouse

False or True?",12b,belief,False,False
23,23,23,23,23,23,23,23,23,23,23,23,23,23,23,23,23,23,23,23,23,23,23,23,23,23,23,23,23,23,23,23,23,23,23,23,23,23,23,23,23,23,23,23,23,23,23,23,23,23,23,23,23,23,23,23,23,23,23,23,23,23,23,23,23,23,23,23,23,23,"In the photograph, the young girl has
long blond hair that cascades down her back. 
Today, she has black hair that falls
at her shoulders. ","Childhood pictures show the 
girl with short black hair

False or True?",12p,photo,False,False
24,24,24,24,24,24,24,24,24,24,24,24,24,24,24,24,24,24,24,24,24,24,24,24,24,24,24,24,24,24,24,24,24,24,24,24,24,24,24,24,24,24,24,24,24,24,24,24,24,24,24,24,24,24,24,24,24,24,24,24,24,24,24,24,24,24,24,24,24,24,"Jennifer went to the theme park when 
it first opened and spent hours 
on the rides. A year ago, unbeknownst
to Jennifer, the park 
closed due to lack of funding.","Jennifer goes to the park to
find that it has closed

False or True?",13b,belief,True,False
25,25,25,25,25,25,25,25,25,25,25,25,25,25,25,25,25,25,25,25,25,25,25,25,25,25,25,25,25,25,25,25,25,25,25,25,25,25,25,25,25,25,25,25,25,25,25,25,25,25,25,25,25,25,25,25,25,25,25,25,25,25,25,25,25,25,25,25,25,25,"Alice arrives at the movie theater at 6PM
for her date with Juan. There is no sign
of him so she leaves after 30 minutes.
Thinking that the movie starts at 7PM,
Juan arrives with ten minutes to spare.","Juan arrives and doesn't see Alice

False or True?",13p,photo,True,False
26,26,26,26,26,26,26,26,26,26,26,26,26,26,26,26,26,26,26,26,26,26,26,26,26,26,26,26,26,26,26,26,26,26,26,26,26,26,26,26,26,26,26,26,26,26,26,26,26,26,26,26,26,26,26,26,26,26,26,26,26,26,26,26,26,26,26,26,26,26,"After a morning of sunbathing, Leslie 
leaves her book on the sunchair expecting
to return after lunch. Her mother notices
that rainclouds are gathering and brings 
the book inside. ","Leslie returns later and 
finds the book soaking wet

False or True?",14b,belief,False,False
27,27,27,27,27,27,27,27,27,27,27,27,27,27,27,27,27,27,27,27,27,27,27,27,27,27,27,27,27,27,27,27,27,27,27,27,27,27,27,27,27,27,27,27,27,27,27,27,27,27,27,27,27,27,27,27,27,27,27,27,27,27,27,27,27,27,27,27,27,27,"The professor sends an email to the 
class the night before to postpone
the midterm exam. John does not
receive the email. ","John sits the exam the next day
and gets a good grade

False or True?",14p,photo,False,False
28,28,28,28,28,28,28,28,28,28,28,28,28,28,28,28,28,28,28,28,28,28,28,28,28,28,28,28,28,28,28,28,28,28,28,28,28,28,28,28,28,28,28,28,28,28,28,28,28,28,28,28,28,28,28,28,28,28,28,28,28,28,28,28,28,28,28,28,28,28,"Maria wakes up early to study
at the library. Her housemates
notice that she is not at breakfast
and presume that she is sleeping","In fact, Maria is studying in the library

False or True?",15b,belief,True,False
29,29,29,29,29,29,29,29,29,29,29,29,29,29,29,29,29,29,29,29,29,29,29,29,29,29,29,29,29,29,29,29,29,29,29,29,29,29,29,29,29,29,29,29,29,29,29,29,29,29,29,29,29,29,29,29,29,29,29,29,29,29,29,29,29,29,29,29,29,29,"The autobiography of the actor
depicts a prosperous and extravagant 
lifestyle. Soon after the book is 
written the actor loses his fortune. ","In the autobiography, the actor is 
depicted as destitute and broke

False or True?",15p,photo,False,True
30,30,30,30,30,30,30,30,30,30,30,30,30,30,30,30,30,30,30,30,30,30,30,30,30,30,30,30,30,30,30,30,30,30,30,30,30,30,30,30,30,30,30,30,30,30,30,30,30,30,30,30,30,30,30,30,30,30,30,30,30,30,30,30,30,30,30,30,30,30,"Sarah texts Paul to let him
know that she will miss dinner 
because she is working late. Paul 
has lost his phone and does not
get her message. ","Paul expects Sarah to be home for dinner

False or True?",16b,belief,True,True
31,31,31,31,31,31,31,31,31,31,31,31,31,31,31,31,31,31,31,31,31,31,31,31,31,31,31,31,31,31,31,31,31,31,31,31,31,31,31,31,31,31,31,31,31,31,31,31,31,31,31,31,31,31,31,31,31,31,31,31,31,31,31,31,31,31,31,31,31,31,"In her prom picture, Laura
has braces on her teeth and long 
blond hair. Soon after the picture 
was taken, Laura's braces were removed","Today, Laura has straight teeth
and long blond hair

False or True?",16p,photo,True,False
32,32,32,32,32,32,32,32,32,32,32,32,32,32,32,32,32,32,32,32,32,32,32,32,32,32,32,32,32,32,32,32,32,32,32,32,32,32,32,32,32,32,32,32,32,32,32,32,32,32,32,32,32,32,32,32,32,32,32,32,32,32,32,32,32,32,32,32,32,32,"Michael told Andrew that he was
going hiking for the day. An hour 
into his walk, Michael hurts his
leg and returns home","Michael returns home that evening 
after a long day of hiking

False or True?",17b,belief,False,False
33,33,33,33,33,33,33,33,33,33,33,33,33,33,33,33,33,33,33,33,33,33,33,33,33,33,33,33,33,33,33,33,33,33,33,33,33,33,33,33,33,33,33,33,33,33,33,33,33,33,33,33,33,33,33,33,33,33,33,33,33,33,33,33,33,33,33,33,33,33,"Tom leaves the house without letting 
the dog out. Tom's neighbour hears 
the dog barking and lets her into 
the backyard. 
Later, Tom arrives home from work. ","Tom finds the dog in the backyard

False or True?",17p,photo,True,False
34,34,34,34,34,34,34,34,34,34,34,34,34,34,34,34,34,34,34,34,34,34,34,34,34,34,34,34,34,34,34,34,34,34,34,34,34,34,34,34,34,34,34,34,34,34,34,34,34,34,34,34,34,34,34,34,34,34,34,34,34,34,34,34,34,34,34,34,34,34,"Amy leaves her sister in the library
while she goes to class. Sometime
thereafter, Amy's sister leaves the
library to meet her friend on the other
side of town. ","Amy returns after class and 
finds her sister in the library

False or True?",18b,belief,False,False
35,35,35,35,35,35,35,35,35,35,35,35,35,35,35,35,35,35,35,35,35,35,35,35,35,35,35,35,35,35,35,35,35,35,35,35,35,35,35,35,35,35,35,35,35,35,35,35,35,35,35,35,35,35,35,35,35,35,35,35,35,35,35,35,35,35,35,35,35,35,"Paintings of the town in the early
nineteenth century portray a bustling
marketplace in the town square. In recent 
years, the town square has been ruined
by warfare. ","Paintings of the town square depict 
ruins obliterated by warfare

False or True?",18p,photo,False,False
36,36,36,36,36,36,36,36,36,36,36,36,36,36,36,36,36,36,36,36,36,36,36,36,36,36,36,36,36,36,36,36,36,36,36,36,36,36,36,36,36,36,36,36,36,36,36,36,36,36,36,36,36,36,36,36,36,36,36,36,36,36,36,36,36,36,36,36,36,36,"Annie tells Carl that she has to work late. 
Instead, Annie arrives home before Carl to 
surprise him for his birthday. Carl goes 
out with his friends straight after work,
arriving home late. ","Annie knows that Carl
is out with his friends

False or True?",19b,belief,False,False
37,37,37,37,37,37,37,37,37,37,37,37,37,37,37,37,37,37,37,37,37,37,37,37,37,37,37,37,37,37,37,37,37,37,37,37,37,37,37,37,37,37,37,37,37,37,37,37,37,37,37,37,37,37,37,37,37,37,37,37,37,37,37,37,37,37,37,37,37,37,"The professor asked his graduate student
to present her work at a conference. 
The student is sick on the day of
the conference and she asks a 
colleague to present the work instead. ","The professor's graduate student 
does not give the presentation

False or True?",19p,photo,True,False
38,38,38,38,38,38,38,38,38,38,38,38,38,38,38,38,38,38,38,38,38,38,38,38,38,38,38,38,38,38,38,38,38,38,38,38,38,38,38,38,38,38,38,38,38,38,38,38,38,38,38,38,38,38,38,38,38,38,38,38,38,38,38,38,38,38,38,38,38,38,"Sophie tells her mother that her train 
from Budapest is arriving at 8PM in 
Vienna. Sophie confuses the platform
numbers and boards the train 
to Prague without realising her mistake.","Sophie arrives at the station 
in Prague does not see her mother

False or True?",20b,belief,True,False
39,39,39,39,39,39,39,39,39,39,39,39,39,39,39,39,39,39,39,39,39,39,39,39,39,39,39,39,39,39,39,39,39,39,39,39,39,39,39,39,39,39,39,39,39,39,39,39,39,39,39,39,39,39,39,39,39,39,39,39,39,39,39,39,39,39,39,39,39,39,"An old photograph of the public library
portrays a red-brick building with green
ivy creeping up the side. Soon after
the photograph was taken, the building was 
demolished and the site was left derelict","A photograph taken today shows
an empty site

False or True?",20p,photo,True,False
40,40,40,40,40,40,40,40,40,40,40,40,40,40,40,40,40,40,40,40,40,40,40,40,40,40,40,40,40,40,40,40,40,40,40,40,40,40,40,40,40,40,40,40,40,40,40,40,40,40,40,40,40,40,40,40,40,40,40,40,40,40,40,40,40,40,40,40,40,40,"Josh tells Adam that he will meet 
him at the game later that day. 
At the last minute, Josh is called
into work and forgets to tell Adam.","Adam cannot find Josh in the stadium

False or True? ",21b,belief,True,False
41,41,41,41,41,41,41,41,41,41,41,41,41,41,41,41,41,41,41,41,41,41,41,41,41,41,41,41,41,41,41,41,41,41,41,41,41,41,41,41,41,41,41,41,41,41,41,41,41,41,41,41,41,41,41,41,41,41,41,41,41,41,41,41,41,41,41,41,41,41,"Kate places her keys on the kitchen table 
and goes to her bedroom to take a nap. 
Her boyfriend sees Kate's keys and places
them in her bag where she usually keeps them","Kate wakes from her nap and 
looks for her keys in her bag

False or True?",21p,photo,False,False
42,42,42,42,42,42,42,42,42,42,42,42,42,42,42,42,42,42,42,42,42,42,42,42,42,42,42,42,42,42,42,42,42,42,42,42,42,42,42,42,42,42,42,42,42,42,42,42,42,42,42,42,42,42,42,42,42,42,42,42,42,42,42,42,42,42,42,42,42,42,"In her acclaimed novel, the author wrote
about the marble statue of the Madonna
that was the pride of the city.
Soon after the book was published,
the statue was destroyed by rebels and
later replaced with an oak tree. ","The novel describes the oak tree as being
the pride of the city

False or True? ",22b,belief,False,False
43,43,43,43,43,43,43,43,43,43,43,43,43,43,43,43,43,43,43,43,43,43,43,43,43,43,43,43,43,43,43,43,43,43,43,43,43,43,43,43,43,43,43,43,43,43,43,43,43,43,43,43,43,43,43,43,43,43,43,43,43,43,43,43,43,43,43,43,43,43,"The couple recently moved to a new house.
They ask the babysitter to watch their 
children while they go out to dinnner. They 
forget to tell her that they have moved house. ","The babysitter arrives at their new house

False or True?",22p,photo,False,False
44,44,44,44,44,44,44,44,44,44,44,44,44,44,44,44,44,44,44,44,44,44,44,44,44,44,44,44,44,44,44,44,44,44,44,44,44,44,44,44,44,44,44,44,44,44,44,44,44,44,44,44,44,44,44,44,44,44,44,44,44,44,44,44,44,44,44,44,44,44,"The schoolteacher asks the children 
to bring in their favourite toys. 
Michelle is sick at home and does 
not get the message. Michelle arrives
at school the following day. ","Michelle did not bring a toy into school

False or True?",23b,belief,True,False
45,45,45,45,45,45,45,45,45,45,45,45,45,45,45,45,45,45,45,45,45,45,45,45,45,45,45,45,45,45,45,45,45,45,45,45,45,45,45,45,45,45,45,45,45,45,45,45,45,45,45,45,45,45,45,45,45,45,45,45,45,45,45,45,45,45,45,45,45,45,"The Nelson Pillar was a granite pillar
that was erected by the British in Dublin.
In 1966 it was destroyed by the Irish
republicans. Today the Spire of Dublin
stands on its former ground.","Today, the Nelson Pillar
stands tall in Dublin

False or True?",23p,photo,False,False
46,46,46,46,46,46,46,46,46,46,46,46,46,46,46,46,46,46,46,46,46,46,46,46,46,46,46,46,46,46,46,46,46,46,46,46,46,46,46,46,46,46,46,46,46,46,46,46,46,46,46,46,46,46,46,46,46,46,46,46,46,46,46,46,46,46,46,46,46,46,"Jillian and Edward are at a real estate
auction and they are both interested
in purchasing a dark chesnut ottoman. 
However, before they can start bidding,
a mystery buyer acquires the ottoman","Both Jillian and Edward leave
the auction with the ottoman

False or True?",24b,belief,False,False
47,47,47,47,47,47,47,47,47,47,47,47,47,47,47,47,47,47,47,47,47,47,47,47,47,47,47,47,47,47,47,47,47,47,47,47,47,47,47,47,47,47,47,47,47,47,47,47,47,47,47,47,47,47,47,47,47,47,47,47,47,47,47,47,47,47,47,47,47,47,"Sally attends the high-school production
of ""Romeo and Juliet"" to support her
sister who is playing the role of 
Juliet. Before the play begins, Sally
receives an urgent phone call and
leaves the theater, missing the show. ","Sally misses the production
of ""Romeo and Juliet""

False or True?",24p,photo,True,False
