48,48,48,48,48,48,48,48,48,48,48,48,48,48,48,48,48,48,48,48,48,48,48,48,48,48,48,48,48,48,48,48,48,48,48,48,48,48,48,48,48,48,48,48,48,48,48,48,48,48,48,48,48,48,48,48,48,48,48,48,48,48,48,48,48,48,48,48,48,48,"The national geographic included
a photograph of the mountaineer 
John Edwards at the base camp of
Mount Everest in 1985. Ten years 
after the piece was published,
John Edwards reached the summit.","In the national geographic, 
John Edwards is photographed
at the base camp of Mount Everest

False or True?",25b,belief,True,False
49,49,49,49,49,49,49,49,49,49,49,49,49,49,49,49,49,49,49,49,49,49,49,49,49,49,49,49,49,49,49,49,49,49,49,49,49,49,49,49,49,49,49,49,49,49,49,49,49,49,49,49,49,49,49,49,49,49,49,49,49,49,49,49,49,49,49,49,49,49,"The novel, written in 1975, depicts
the Berlin wall as a barrier that 
cuts off West Berlin from surrounding
East Berlin. Years after the book
was published, the wall was opened by
government officials.","The Berlin Wall still stands today

False or True?",25p,photo,False,False
50,50,50,50,50,50,50,50,50,50,50,50,50,50,50,50,50,50,50,50,50,50,50,50,50,50,50,50,50,50,50,50,50,50,50,50,50,50,50,50,50,50,50,50,50,50,50,50,50,50,50,50,50,50,50,50,50,50,50,50,50,50,50,50,50,50,50,50,50,50,"Felicity skips school to attend
a basketball game at the local
stadium. Unbeknownst to her, she
is filmed by a news station. Her
parents watch the news that afternoon
and see her enjoying the game","Felicity's parents think that 
she is at school

False or True?",26b,belief,True,False
51,51,51,51,51,51,51,51,51,51,51,51,51,51,51,51,51,51,51,51,51,51,51,51,51,51,51,51,51,51,51,51,51,51,51,51,51,51,51,51,51,51,51,51,51,51,51,51,51,51,51,51,51,51,51,51,51,51,51,51,51,51,51,51,51,51,51,51,51,51,"Historical accounts of the time describe
how Cuba was inhabited by Amerindian
tribes. The country was later colonised
by Spain in the late 15th century. 
It remained a colony of Spain until the
Spanish-American War of 1898.","When the historical accounts
were written, Cuba was not
a colony of Spain. 

False or True?",26p,photo,True,False
52,52,52,52,52,52,52,52,52,52,52,52,52,52,52,52,52,52,52,52,52,52,52,52,52,52,52,52,52,52,52,52,52,52,52,52,52,52,52,52,52,52,52,52,52,52,52,52,52,52,52,52,52,52,52,52,52,52,52,52,52,52,52,52,52,52,52,52,52,52,"In her autobiography, the athlete
states that she has never used 
performance-enhancing drugs. Five
years after the book is published, the
athlete fails a routine drug test. ","According to her autobiography,
the athlete has never used 
performance-enhancing drugs

False or True? ",27b,belief,True,False
53,53,53,53,53,53,53,53,53,53,53,53,53,53,53,53,53,53,53,53,53,53,53,53,53,53,53,53,53,53,53,53,53,53,53,53,53,53,53,53,53,53,53,53,53,53,53,53,53,53,53,53,53,53,53,53,53,53,53,53,53,53,53,53,53,53,53,53,53,53,"Matthew and Harry spend the morning
skiing in the alps. After lunch, they
decide the split up, agreeing to meet
at the cabin later that afternoon.
Soon after, both men break their
skis and return to the cabin","Matthew is surprised to
see Harry at the cabin

False or True?",27p,photo,True,False
54,54,54,54,54,54,54,54,54,54,54,54,54,54,54,54,54,54,54,54,54,54,54,54,54,54,54,54,54,54,54,54,54,54,54,54,54,54,54,54,54,54,54,54,54,54,54,54,54,54,54,54,54,54,54,54,54,54,54,54,54,54,54,54,54,54,54,54,54,54,"In the end-of-year photograph, the
girls are dressed in red sweaters and
grey skirts - the school uniform.
Soon after, the principal changes
the colour of the uniform to green ","A photograph taken today shows
the school children in green uniforms

False or True? ",28b,belief,True,False
55,55,55,55,55,55,55,55,55,55,55,55,55,55,55,55,55,55,55,55,55,55,55,55,55,55,55,55,55,55,55,55,55,55,55,55,55,55,55,55,55,55,55,55,55,55,55,55,55,55,55,55,55,55,55,55,55,55,55,55,55,55,55,55,55,55,55,55,55,55,"Jack leaves his dog with his mother 
for two weeks while he takes 
a trip to the Bahamas. A few days 
before his trip ends, the dog is 
knocked down by a car and breaks 
both its legs. To avoid upset, 
Jack is not informed of this incident. ","Jack returns from his trip
and is pleased to see that
his dog is uninjured

False or True? ",28p,photo,False,False
56,56,56,56,56,56,56,56,56,56,56,56,56,56,56,56,56,56,56,56,56,56,56,56,56,56,56,56,56,56,56,56,56,56,56,56,56,56,56,56,56,56,56,56,56,56,56,56,56,56,56,56,56,56,56,56,56,56,56,56,56,56,56,56,56,56,56,56,56,56,"Before Anna left for summer camp, 
she had long brown hair and pale 
skin. Over the course of five weeks, 
Anna's hair turns golden blond and she 
returns tanned and freckled by the sun","A photograph taken of Anna
before camp shows her with 
tanned and freckled skin

False or True?",29b,belief,False,False
57,57,57,57,57,57,57,57,57,57,57,57,57,57,57,57,57,57,57,57,57,57,57,57,57,57,57,57,57,57,57,57,57,57,57,57,57,57,57,57,57,57,57,57,57,57,57,57,57,57,57,57,57,57,57,57,57,57,57,57,57,57,57,57,57,57,57,57,57,57,"A famous celebrity is scheduled to 
attend the Grammy awards to perform
her recent hit song. She cancels
at the last minute due to illness.
The organisers find a replacement
but do not have enough time to 
announce the change","The famous singer performs 
her hit song at the Grammy awards

False or True? ",29p,photo,False,False
